fecha;identificador;ciudad;seccion;id_sec;titulo
2011-04-13;8057;Antofagasta;Sociedad;11;Los choferes confirman que el paro fracasó por miedo a despidos
2011-04-12;8027;Antofagasta;Sociedad;11;El periodista Alejandro Guillier inaugurará año académico en la Universidad de Antofagasta
2011-04-12;8026;Antofagasta;Sociedad;11;La Municipalidad de Antofagasta inauguró juegos infantiles en Población Ana Giglia
2011-04-12;8021;Antofagasta;Policial;11;Una joven ecuatoriana permanece grave en el Hospital Regional de Antofagasta
2011-04-12;8001;Antofagasta;Deportes;11;El joven tenista Bastián Malla está de regreso en Antofagasta
2011-04-12;7995;Antofagasta;Sociedad;11;La Dirección de Aseo comunal erradicará el cementerio ilegal de mascotas
2011-04-12;7974;Antofagasta;Sociedad;11;El Sernac entrega guía para los derechos de los pasajeros
2011-04-12;7951;Antofagasta;Sociedad;11;La empresa IBM elige a Antofagasta para instalar su programa de Ciudad Inteligente
2011-04-12;7961;Antofagasta;Sociedad;11;La Municipalidad de Antofagasta lanza campaña de aseo en las poblaciones
2011-04-12;7946;Antofagasta;Policial;11;Los pobladores de la Coviefi golpearon a un asaltante de taxista
2011-04-12;7935;Antofagasta;Deportes;11;Los dirigentes deportivos de Antofagasta manifestaron sus preocupaciones
2011-04-12;7915;Antofagasta;Policial;11;Los familiares de víctima del volcamiento de bus reclaman negligencia médica
2011-04-12;7906;Antofagasta;Sociedad;11;El seremi de Salud extiende plazo para la vacunación gratuita por la influenza
2011-04-12;7844;Antofagasta;Deportes;11;El CDA regresó a las prácticas con miras a recibir a San Marcos de Arica
2011-04-12;7839;Antofagasta;Sociedad;11;Los contratistas en huelga realizaron una marcha por la ciudad
2011-04-12;7815;Antofagasta;Política;11;La PDI de Calama encontró a mujer desaparecida desde mayo de 2010
2011-04-12;7800;Antofagasta;Policial;11;El fiscal nacional no descarta cómplices en caso de Cecilia Julio
2011-04-12;7791;Antofagasta;Policial;11;Un herido tras volcamiento de un jeep en el sector sur
2011-04-12;7789;Antofagasta;Sociedad;11;El paro de los choferes de las micros fracasó en Antofagasta
2011-04-12;7723;Antofagasta;Sociedad;11;18% de los universitarios antofagastinos está con riesgo por sobrepeso
2011-04-11;7678;Antofagasta;Policial;11;Una mujer agredió a su hija de 23 años con un palo
2011-04-11;7749;Antofagasta;Deportes;11;La atleta antofagastina que piensa en participar en los JJ.OO. 2012
2011-04-11;7741;Antofagasta;Deportes;11;El invicto de Cobreloa femenino llegó a su fin
2011-04-11;7734;Antofagasta;Deportes;11;Tres bajas presenta Cobreloa para el clásico con Cobresal
2011-04-11;7727;Antofagasta;Policial;11;Un antofagastino falleció luego de ser devorado por una jauría de perros
2011-04-11;7716;Antofagasta;Sociedad;11;El Sename denuncia que 150 niños fueron abusados en Antofagasta
2011-04-11;7709;Antofagasta;Policial;11;Un 21,7% disminuyó la tasa los robos de vehículos en Antofagasta
2011-04-11;7719;Antofagasta;Sociedad;11;UDI de Antofagasta efectuará misa en memoria del diputado Juan Lobos
2011-04-11;7674;Antofagasta;Sociedad;11;Los contratistas de Escondida reclaman por sus remuneraciones
2011-04-11;7670;Antofagasta;Policial;11;El obispado de Calama responde ante la denuncia de abuso sexual en contra de catequista
2011-04-11;7665;Antofagasta;Cultura;11;La Orquesta Sinfónica comenzará el viernes su temporada de conciertos
2011-04-11;7652;Antofagasta;Policial;11;La PDI detuvo a sujeto que vendía soldadura robada
2011-04-11;7624;Antofagasta;Sociedad;11;El MOP habilita el Paso Jama para todo tipo de vehículos
2011-04-11;7617;Antofagasta;Sociedad;11;Los conductores del Transantofagasta acusan amenazas por el paro
2011-04-10;7555;Antofagasta;Policial;11;Detienen a catequista acusado de abuso sexual en Calama
2011-04-10;7552;Antofagasta;Policial;11;Trabajador murió aprisionado contra el techo en Calama
2011-04-10;7551;Antofagasta;Sociedad;11;Bomberos de Antofagasta realizaron desfile en honor a su aniversario 136
2011-04-10;7545;Antofagasta;Policial;11;Voraz incendio dejó a 16 personas damnificadas
2011-04-10;7541;Antofagasta;Sociedad;11;Comienza postulación a talleres para Feria Internacional del Libro en Antofagasta
2011-04-10;7537;Antofagasta;Deportes;11;Club de Deportes Antofagasta goleó 4 a 1 a Rangers de Talca
2011-04-10;7534;Antofagasta;Deportes;11;Club Deportes Antofagasta goleó a Rangers por 4 a 1
2011-04-10;7517;Antofagasta;Sociedad;11;Escuela “21 de mayo” de Calama logró el mayor aumento comunal en el SIMCE de matemáticas
2011-04-10;7513;Antofagasta;Policial;11;Encuentran a poblador muero en población Corvallis de Antofagasta
2011-04-10;7508;Antofagasta;Policial;11;Un muerto y 14 heridos tras volcamiento de bus interurbano
2011-04-10;7480;Antofagasta;Policial;11;Volcamiento de bus  deja un muerto y 17 heridos en Cobija
2011-04-10;7461;Antofagasta;Sociedad;11;Parlamentarios exigen paralizar el plan para ampliar Cerro Moreno
2011-04-10;7447;Antofagasta;Sociedad;11;Los diputados de la región intervienen por reiterados fraudes bancarios
2011-04-09;7407;Antofagasta;Sociedad;11;Minera El tesoro entrega certificados y becas a operadores aprendices de Calama
2011-04-09;7406;Antofagasta;Sociedad;11;Nueva empresa francesa estudia tren urbano para Antofagasta
2011-04-09;7403;Antofagasta;Sociedad;11;Embajador de Estados Unidos se reunió con alcaldesa de Antofagasta
2011-04-09;7399;Antofagasta;Sociedad;11;CONAF celebra 21° aniversario del Monumento Natural La Portada
2011-04-09;7396;Antofagasta;Sociedad;11;Bomberos de Antofagasta realizará desfile de aniversario
2011-04-09;7392;Antofagasta;Sociedad;11;Este lunes comenzará fondo concursable de Fundación Minera Escondida
2011-04-09;7383;Antofagasta;Sociedad;11;Bolivia afirmó que acudirá a La Haya por las aguas del río Silala
2011-04-09;7384;Antofagasta;Cultura;11;Congreso animará la última jornada de la Feria Internacional del Libro de Antofagasta
2011-04-09;7377;Antofagasta;Sociedad;11;Seremi de Gobierno, Paulina Núñez evaluó mes de marzo en la Región de Antofagasta
2011-04-09;7372;Antofagasta;Policial;11;Los amigos de la joven asesinada marcharon para pedir justicia
2011-04-09;7363;Antofagasta;Sociedad;11;El aeropuerto Cerro Moreno es uno de los peor evaluados del país
2011-04-09;7366;Antofagasta;Sociedad;11;Micreros comenzarán paro indefinido este martes en Antofagasta
2011-04-09;7357;Antofagasta;Policial;11;Un camión destruyó parte de la basílica Corazón de María
2011-04-09;7352;Antofagasta;Sociedad;11;Camión sin chofer chocó con Basílica Sagrado Corazón de María de Antofagasta
2011-04-08;7253;Antofagasta;Sociedad;11;Dos mil peruanos votarán en Antofagasta para elegir su gobernante
2011-04-08;7249;Antofagasta;Sociedad;11;Las autoridades educacionales buscan terminar con el maltrato escolar
2011-04-08;7246;Antofagasta;Policial;11;Carabineros recupera dos vehículos robados en Antofagasta
2011-04-08;7222;Antofagasta;Policial;11;Intendente Alvaro Fernández visitó a funcionario de la PDI que fue baleado por delincuentes
2011-04-08;7216;Antofagasta;Deportes;11;Gran convocatoria tuvo la clase de gimnasia entretenida
2011-04-08;7210;Antofagasta;Policial;11;La Brigada Antinarcóticos de la PDI dejó 26 detenidos en operativo en Calama
2011-04-08;7205;Antofagasta;Policial;11;"""Vamos a echarle a perder el negocio a los delincuentes"""
2011-04-08;7198;Antofagasta;Policial;11;Narcos intentaban ingresar droga a la cárcel de Tocopilla en hamburgesas
2011-04-08;7192;Antofagasta;Policial;11;Carabineros dieron un golpe al microtráfico en la Población René Schneider
2011-04-08;7181;Antofagasta;Policial;11;Un turista francés falleció mientras se encontraba visitando El Tatio
2011-04-08;7153;Antofagasta;Policial;11;30 personas son detenidas por tráfico de drogas en Antofagasta
2011-04-08;7116;Antofagasta;Policial;11;Piñera anunció en Antofagasta un nuevo plan para frenar la delincuencia
2011-04-08;7096;Antofagasta;Deportes;11;Dirigentes discutieron sobre la Ley del Deporte en Tocopilla
2011-04-07;7039;Antofagasta;Economía y Negocios;11;Presidente Piñera inauguró Minera Esperanza en la Región de Antofagasta
2011-04-07;6996;Antofagasta;Sociedad;11;Más de 100 operarios realizan labores de limpieza en las calles de la ciudad
2011-04-07;6944;Antofagasta;Sociedad;11;Los estudiantes de la región reivindicaron sus conocimientos tras los resultados del SIMCE
2011-04-07;6943;Antofagasta;Policial;11;Delincuentes disparan a los detectives en sector norte de Antofagasta
2011-04-07;6939;Antofagasta;Sociedad;11;Directora de la Onemi descarta un tsunami en Antofagasta
2011-04-07;6928;Antofagasta;Sociedad;11;Aguas Antofagasta insiste en que compensará a clientes por cortes
2011-04-07;6911;Antofagasta;Deportes;11;Campeonato de bodyboard reunirá a deportistas de todo el país en Antofagasta
2011-04-07;6910;Antofagasta;Sociedad;11;El conductor de un camión quedó herido tras volcar en ruta minera
2011-04-07;6890;Antofagasta;Sociedad;11;Los emprendedores y microempresarios de la región registran un aumento en postulación a Capital Semilla
2011-04-07;6881;Antofagasta;Sociedad;11;La población Coviefi está incluída en el nuevo sistema de barrido de calles
2011-04-07;6875;Antofagasta;Sociedad;11;Piñera lanza el plan de inversión e inaugura la Minera Esperanza
2011-04-07;6871;Antofagasta;Sociedad;11;La región sigue en la zona roja de la prueba Simce
2011-04-07;6869;Antofagasta;Economía y Negocios;11;El Presidente Sebastián Piñera encabezará inauguración de Minera Esperanza
2011-04-07;6855;Antofagasta;Sociedad;11;Crece el riesgo sanitario por el cementerio de mascotas
2011-04-07;6853;Antofagasta;Sociedad;11;Fracasó el acuerdo con la sanitaria por cortes de agua
2011-04-06;6822;Antofagasta;Sociedad;11;Estudiantes destacados recibieron computadores y notebooks de última generación
2011-04-06;6808;Antofagasta;Sociedad;11;Las autoridades realizan recreo activo para los escolares
2011-04-06;6801;Antofagasta;Sociedad;11;El embajador de Estados Unidos realizará visita a Antofagasta
2011-04-06;6768;Antofagasta;Economía y Negocios;11;Partieron concursos internos para los trabajadores de Chuquicamata
2011-04-06;6761;Antofagasta;Sociedad;11;El Presidente Piñera llega mañana a lanzar Plan Antofagasta
2011-04-06;6756;Antofagasta;Sociedad;11;"Los estudiantes de la U. del Mar entrevistarán al mítico líder de ""Sex Pistols"""
2011-04-06;6744;Antofagasta;Sociedad;11;El seremi de Medio Ambiente confirma que mejoró la calidad del aire
2011-04-06;6702;Antofagasta;Sociedad;11;SERNAC no aceptó la propuesta de compensación de Aguas Antofagasta
2011-04-06;6684;Antofagasta;Deportes;11;Las cábalas que tiene Cobreloa para un buen resultado en la cancha
2011-04-06;6678;Antofagasta;Deportes;11;Gustavo Huerta trabaja para ganar los puntos fuera de casa
2011-04-06;6677;Antofagasta;Sociedad;11;El Sernac rechaza la compensación de Aguas Antofagasta
2011-04-06;6670;Antofagasta;Sociedad;11;A más de tres años del terremoto: Las sedes sociales de Tocopilla siguen en el suelo
2011-04-06;6669;Antofagasta;Sociedad;11;Vuelo de Sky debió regresar a Santiago por falla mecánica
2011-04-06;6662;Antofagasta;Sociedad;11;"""Si la gente no se mueve ya, se quedarán sin casas en Tocopilla"""
2011-04-06;6655;Antofagasta;Sociedad;11;Reaparecen los basurales en ruta de acceso a la ciudad
2011-04-06;6645;Antofagasta;Deportes;11;La joven promesa antofagastina fue cedida a la Universidad Católica
2011-04-06;6620;Antofagasta;Sociedad;11;Baja el índice de los delitos en la región de Antofagasta
2011-04-06;6545;Antofagasta;Sociedad;11;Los parlamentarios de la región están molestos por el recorte presupuestario
2011-04-05;6598;Antofagasta;Sociedad;11;Estudio dice que el aire de Antofagasta es de buena calidad
2011-04-05;6596;Antofagasta;Economía y Negocios;11;Minería chilena está preocupada por el posible gran terremoto en el Norte Grande
2011-04-05;6589;Antofagasta;Policial;11;Menor fue detenido por disparar en contra de un carabinero
2011-04-05;6579;Antofagasta;Sociedad;11;"Antofagasta se levanta como una ""Ciudad Modelo"""
2011-04-05;6570;Antofagasta;Sociedad;11;Pavimentación llegó hasta el poniente rural de Calama
2011-04-05;6567;Antofagasta;Policial;11;Menores causan gran conmoción al publicar fotografías portando armas blancas
2011-04-05;6557;Antofagasta;Cultura;11;El mejor cine europeo se toma esta noche el Café Vicente Huidobro de Calama
2011-04-05;6547;Antofagasta;Sociedad;11;Por quinta vez es destrozada cámara en la avenida Las Palmeras
2011-04-05;6527;Antofagasta;Sociedad;11;Estudiantes destacados recibieron computadores y notebooks de última generación
2011-04-05;6516;Antofagasta;Policial;11;Un adolescente de 14 años disparó contra los carabineros
2011-04-05;6506;Antofagasta;Deportes;11;Antofagastinos celebrarán el Día Internacional de la Actividad Física
2011-04-05;6500;Antofagasta;Cultura;11;El cantautor Javier Barría presentará su última producción discográfica
2011-04-05;6482;Antofagasta;Cultura;11;Artistas son llamados a postular al histórico evento cultural
2011-04-05;6458;Antofagasta;Policial;11;PDI de Antofagasta detuvo a un sujeto que abusaba de menores
2011-04-05;6432;Antofagasta;Deportes;11;Hace nueve años que Cobreloa no puede ganarle a Universidad Católica
2011-04-05;6416;Antofagasta;Policial;11;Un sujeto fue detenido tras abusar sexualmente de cuatro menores
2011-04-05;6415;Antofagasta;Economía y Negocios;11;Proyecto busca potenciar el trabajo ganadero en San Pedro de Atacama
2011-04-05;6409;Antofagasta;Deportes;11;CDA comienza a prepararse para enfrentar al líder de la Primera B
2011-04-05;6396;Antofagasta;Deportes;11;Club Deportes Antofagasta viaja a Talca para derrotar al puntero Rangers
2011-04-05;6379;Antofagasta;Economía y Negocios;11;El sector minero está preocupado por un posible gran terremoto
2011-04-05;6377;Antofagasta;Sociedad;11;La autoridad sanitaria realiza controles antes de la Semana Santa
2011-04-05;6372;Antofagasta;Sociedad;11;Los consultorios están en alerta por la llegada de los virus invernales
2011-04-05;6362;Antofagasta;Sociedad;11;Las constructoras inician la lucha por la construcción del hospital
2011-04-04;6342;Antofagasta;Política;11;Concejal Urdangarín ofreció disculpas públicas a alcalde de Calama Esteban Velásquez
2011-04-04;6340;Antofagasta;Policial;11;PDI de Antofagasta recuperó vehículo robado
2011-04-04;6334;Antofagasta;Sociedad;11;INDAP Antofagasta entregó más de 120 millones de pesos en incentivos de riego asociativo
2011-04-04;6332;Antofagasta;Sociedad;11;Anciano tocopillano se encuentra grave tras caer de un segundo piso
2011-04-04;6327;Antofagasta;Sociedad;11;Alcaldesa de Antofagasta, Marcela Hernando se reunió con reconocido arquitecto
2011-04-04;6325;Antofagasta;Policial;11;Hallan cuerpo sin vida en sector alto de Antofagasta
2011-04-04;6321;Antofagasta;Sociedad;11;Municipio de Antofagasta reiteró apoyo al deporte local
2011-04-04;6310;Antofagasta;Deportes;11;Agrupación antofagastina de cheerleaders viaja a Estados Unidos
2011-04-04;6307;Antofagasta;Cultura;11;En plena marcha los arreglos en el Teatro Municipal
2011-04-04;6301;Antofagasta;Policial;11;Vagabundo falleció en plena vía pública de Antofagasta
2011-04-04;6287;Antofagasta;Deportes;11;CDA derrotó por la mínima a San Marcos de Arica
2011-04-04;6253;Antofagasta;Cultura;11;Fondart abre postulaciones para becas de perfeccionamiento
2011-04-04;6275;Antofagasta;Economía y Negocios;11;Codelco realizará una inversión de US$ 17.500 millones
2011-04-04;6264;Antofagasta;Economía y Negocios;11;Federación Minera realizará reunión de emergencia tras demanda de Collahuasi
2011-04-04;6250;Antofagasta;Sociedad;11;Seremi de salud Marcos Madrigal fiscalizó ventas de mariscos por Semana Santa
2011-04-04;6241;Antofagasta;Cultura;11;Ya están abiertas las postulaciones para formación cultural en
2011-04-04;6234;Antofagasta;Deportes;11;IND se reúne con entidades deportivas de Tocopilla
2011-04-04;6222;Antofagasta;Sociedad;11;Federación Minera de Chile entrega respaldo ante querella interpuesta a trabajadores de Collahuasi
2011-04-04;6217;Antofagasta;Sociedad;11;Alcaldes de la Región de Antofagasta comenzaron trabajo para equipar municipios en casos de emergencia
2011-04-04;6209;Antofagasta;Deportes;11;Comenzaron las actividades de celebración del 136° aniversario de Bomberos de Antofagasta
2011-04-04;6204;Antofagasta;Sociedad;11;Conmoción entre los twitteros por ovnis en el Parque Inglés
2011-04-04;6197;Antofagasta;Cultura;11;Escritor antofagastino Antonio Skármeta estará presente en la Feria Internacional del Libreo Zicosur
2011-04-04;6184;Antofagasta;Tecnología;11;Paranal realiza nuevo descubrimiento estelar
2011-04-04;6167;Antofagasta;Policial;11;Vagos desmantelan un taxibús abandonado en Antofagasta
2011-04-04;6163;Antofagasta;Política;11;Diputado enciende polémica por evaluación en Intendencia
2011-04-03;6153;Antofagasta;Sociedad;11;La seremi de Gobierno escuchó a los vecinos de las Salitreras Unidas
2011-04-03;6147;Antofagasta;Deportes;11;Club Deportes Antofagasta venció 1-0 a San Marcos de Arica
2011-04-03;6144;Antofagasta;Cultura;11;El escritor Antonio Skármeta destacó el talento literario regional
2011-04-03;6139;Antofagasta;Sociedad;11;Senador Gómez y alcaldes de la región de Antofagasta comenzaron trabajo para equipar municipios en casos de emergencia
2011-04-03;6138;Antofagasta;Policial;11;Prisión preventiva en Antofagasta para presunto autor de homicio en Calama
2011-04-03;6134;Antofagasta;Policial;11;Joven mujer de 29 se transformó en la octava víctima de femicidio en Antofagasta
2011-04-03;6130;Antofagasta;Deportes;11;Club de Deportes Antofagasta derrotó a San Marcos de Arica
2011-04-03;6120;Antofagasta;Policial;11;Futuro abogado fue asesinado en Antofagasta
2011-04-03;6128;Antofagasta;Economía y Negocios;11;La Corfo llama a potenciar negocios de tecnología en la región
2011-04-03;6092;Antofagasta;Policial;11;15 detenidos arrojó operativo de la PDI al norte de Antofagasta
2011-04-03;6082;Antofagasta;Policial;11;Vecinos de Antofagasta atemorizados por riesgo de incendio en local de pollos
2011-04-03;6071;Antofagasta;Policial;11;Fiscalía de Antofagasta investiga homicidio de supuesto asaltante
2011-04-03;6056;Antofagasta;Sociedad;11;El senador José Antonio Gómez busca mejorar la respuesta comunal ante catástrofes
2011-04-03;6040;Antofagasta;Sociedad;11;El intendente de Antofagasta apoya la rebaja del 7% en salud a adultos mayores
2011-04-03;6032;Antofagasta;Sociedad;11;La Asociación de Industriales de Antofagasta impulsa descontaminación en La Chimba
2011-04-03;6023;Antofagasta;Deportes;11;El geógrafo Marcelo Lagos describe el tsunami que se avecina en el norte
2011-04-02;5942;Antofagasta;Sociedad;11;Operativo Municipal desaloja a vagabundos en Playa Paraíso de Antofagasta
2011-04-02;5938;Antofagasta;Sociedad;11;Inspectores municipales fiscalizan venta de alimentos en calles de Antofagasta
2011-04-02;5937;Antofagasta;Sociedad;11;Comenzó festival de la cerveza en Antofagasta
2011-04-02;5924;Antofagasta;Sociedad;11;Biblioteca Nº 120 de Antofagasta celebró “Día Internacional del libro Infantil y Juvenil”
2011-04-02;5919;Antofagasta;Deportes;11;El director regional del IND cree en subsede para el mundial en Antofagasta
2011-04-02;5908;Antofagasta;Sociedad;11;Corfo y Sernam realizan taller para impulsar el emprendimiento femenino en la región de Antofagasta
2011-04-02;5902;Antofagasta;Espectáculos;11;Luis Jara viene a enamorar con sus éxitos
2011-04-02;5900;Antofagasta;Sociedad;11;Municipio de Antofagasta finalizó proceso de permisos de circulación 2011
2011-04-02;5895;Antofagasta;Sociedad;11;Alcaldesa de Antofagasta, Marcela Hernando, dio el vamos a cuarta etapa de recambio de aceras en el centro de la ciudad
2011-04-02;5886;Antofagasta;Deportes;11;CDA realiza su último entrenamiento en Arica antes de enfrentar a San Marcos
2011-04-02;5884;Antofagasta;Deportes;11;Boris González: “Ante Palestino no tenemos margen de error”
2011-04-02;5880;Antofagasta;Economía y Negocios;11;La minería sigue como el gran imán para la inversión extranjera
2011-04-02;5877;Antofagasta;Deportes;11;Dirigentes deportivos de la región analizan Ley del Deporte en Calama
2011-04-02;5876;Antofagasta;Policial;11;Incautan más de 200 kilos de droga en la región
2011-04-02;5872;Antofagasta;Sociedad;11;Intendente regional, Álvaro Fernández y seremi de transportes, Ricardo Varas fiscalizan rebaja tarifaria en microbuses de Antofagasta
2011-04-02;5850;Antofagasta;Policial;11;Investigan a una mujer por robar a gendarmes
2011-04-02;5842;Antofagasta;Sociedad;11;El municipio inició la reparación de veredas en el centro de Antofagasta
2011-04-02;5835;Antofagasta;Sociedad;11;Los profesores bien evaluados emigran a los colegios privados
2011-04-02;5825;Antofagasta;Sociedad;11;Los clientes continúan sin compensación por los cortes de agua sufridos en la ciudad
2011-04-02;5819;Antofagasta;Sociedad;11;Un sorpresivo paro dejó sin transporte a los antofagastinos
2011-04-01;5794;Antofagasta;Deportes;11;Seremi de Obras Públicas espera un estadio de lujo para Antofagasta
2011-04-01;5789;Antofagasta;Deportes;11;Instituto Nacional del Deporte inicia ciclo de charlas
2011-04-01;5773;Antofagasta;Policial;11;Gendarme de Tocopilla utilizaba a su ex pareja para estafar a sus colegas
2011-04-01;5750;Antofagasta;Deportes;11;Antofagasta sigue soñando con ser sede del Mundial Sub 17
2011-04-01;5718;Antofagasta;Deportes;11;El técnico Gustavo Huerta prepara el duelo contra San Marcos de Arica
2011-04-01;5690;Antofagasta;Sociedad;11;La PDI se encuentra alerta por el aumento de las estafas electrónicas
2011-04-01;5668;Antofagasta;Sociedad;11;"Intendente Alvaro Fernández y reducción del 7 % de salud: ""Estamos cumpliendo con nuestros adultos mayores"""
2011-04-01;5666;Antofagasta;Política;11;Senador Gómez exigió instalar telefonía celular en la ruta hacia Mejillones
2011-04-01;5664;Antofagasta;Política;11;Senador Gómez pide aprovechar el potencial energético solar de la Región de Antofagasta
2011-04-01;5650;Antofagasta;Sociedad;11;Indignación en vecinos de Pacífico Norte  de Tocopilla por retraso en obras de acceso a población
2011-04-01;5647;Antofagasta;Sociedad;11;Paro de las micros en Antofagasta podría extenderse durante el fin de semana
2011-04-01;5639;Antofagasta;Sociedad;11;95% de los choferes de taxibuses paralizan en Antofagasta
2011-03-31;5565;Antofagasta;Cultura;11;Biblioteca celebrará en grande el Día Internacional del Libro Infantil y Juvenil
2011-03-31;5563;Antofagasta;Sociedad;11;Población Favorecedora da inicio a un nuevo mes de operativos de aseo
2011-03-31;5558;Antofagasta;Sociedad;11;Gobierno y Adutax firmaron el acuerdo que rebaja la tarifa para adultos y estudiantes
2011-03-31;5551;Antofagasta;Sociedad;11;Intentan agredir a inspectores municipales por fiscalizar venta de alimentos en la vía pública
2011-03-31;5571;Antofagasta;Deportes;11;El estadio de Antofagasta será remodelado desde junio
2011-03-31;5409;Antofagasta;Policial;11;Los padres de Carolina Arias dan lucha por su nieto
2011-03-31;5509;Antofagasta;Policial;11;Reo se escapó desde la cárcel del puerto salitrero
2011-03-31;5508;Antofagasta;Policial;11;Murió tras fatal puñalada de sujeto que dijo actuar en defensa propia
2011-03-31;5408;Antofagasta;Sociedad;11;Antofagastinos sufren los negativos efectos por la extensión del horario de verano
2011-03-31;5410;Antofagasta;Sociedad;11;Los nuevos gendarmes viven hacinados al interior de la cárcel de Antofagasta
2011-03-31;5420;Antofagasta;Sociedad;11;Minera Escondida invierte US$ 554 millones para aumentar su producción
2011-03-31;5414;Antofagasta;Economía y Negocios;11;Aumentan las ventas y el número de visitas en el mall antofagastino
2011-03-31;5486;Antofagasta;Deportes;11;El goleador César Díaz dio un merecido triunfo al CDA
2011-03-31;5503;Antofagasta;Policial;11;PDI desvirtúa denuncia por una violación
2011-03-31;5496;Antofagasta;Sociedad;11;Rutas de la región consideradas Zonas de Silencio tendrán cobertura para celulares
2011-03-31;5487;Antofagasta;Policial;11;Incendio dejó dos habitaciones completamente destruidas
2011-03-31;5482;Antofagasta;Sociedad;11;INDAP Región de Antofagasta dio nuevo impulso al PRODESAL
2011-03-31;5476;Antofagasta;Sociedad;11;Agencia de Desarrollo Productivo y Servicios Públicos firman acuerdo para potenciar áreas importantes de la región
2011-03-30;5390;Antofagasta;Sociedad;11;Antofagastina ganó en el casino más de $ 52 millones con sólo $ 1.500
2011-03-30;5386;Antofagasta;Deportes;11;Ministerio de Obras Públicas abre propuestas para nuevo estadio en Antofagasta
2011-03-30;5379;Antofagasta;Economía y Negocios;11;Presidente de Codelco pidió comprensión por despidos en Chuquicamata
2011-03-30;5357;Antofagasta;Sociedad;11;Seremi de gobierno escuchó inquietudes  de la junta vecinal Salitreras Unidas
2011-03-30;5322;Antofagasta;Economía y Negocios;11;Exponor 2011 remece el mercado local por alta demanda de servicios
2011-03-30;5298;Antofagasta;Sociedad;11;Diputados buscan elevar la seguridad en los furgones escolares
2011-03-30;5289;Antofagasta;Sociedad;11;El gobernador de Antofagasta frena los excesos en las fiestas universitarias
2011-03-30;5306;Antofagasta;Policial;11;El asesino de Carolina Arias fue condenado a 24 años de cárcel
2011-03-30;5246;Antofagasta;Sociedad;11;Senador Cantero pide no satanizar la alternativa de la energía nuclear
2011-03-30;5240;Antofagasta;Sociedad;11;El intendente Alvaro Fernández no descarta cambios en polémica obra del aeropuerto
