fecha;identificador;ciudad;seccion;id_sec;titulo
2011-03-30;5233;Antofagasta;Sociedad;11;Los antofagastinos serán favorecidos con histórica rebaja de pasajes en los taxibuses
2011-03-30;5232;Antofagasta;Sociedad;11;Los antofagastinos serán favorecidos con histórica rebaja de pasajes en los taxibuses
2011-03-29;5184;Antofagasta;Deportes;11;El Instituto Nacional de Deportes realizó gira regional
2011-03-29;5181;Antofagasta;Deportes;11;La Fuerza Aérea organizó cross country en pleno desierto
2011-03-29;5174;Antofagasta;Sociedad;11;Un nuevo proyecto productivo extiende la vida útil de la mina Mantos Blancos
2011-03-29;5128;Antofagasta;Sociedad;11;Concesionario de aeropuerto anuncia colapso del terminal
2011-03-29;5145;Antofagasta;Policial;11;Los vagabundos invaden el terminal pesquero de Antofagasta
2011-03-29;5106;Antofagasta;Sociedad;11;Falla en Puerto Mejillones provocó contaminación
2011-03-29;5110;Antofagasta;Sociedad;11;102 mil personas serán vacunadas contra temida influenza en Antofagasta
2011-03-29;5134;Antofagasta;Sociedad;11;Médicos realizaron 47 cirugías gratuitas en Taltal
2011-03-29;5113;Antofagasta;Sociedad;11;Gobierno construye cruces ferroviarios en nuevas rutas
2011-03-29;5100;Antofagasta;Sociedad;11;Vecinos inician protestas para oponerse a pubs en zona residencial
2011-05-26;17486;Antofagasta;Sociedad;11;La I División de Ejército realiza la Primera Feria de la Vivienda en Antofagasta
2011-05-26;17483;Antofagasta;Deportes;11;Francisco Sepúlveda sustituirá a Carlos Escudero en disputa con Lota
2011-05-26;17482;Antofagasta;Sociedad;11;Autoridades de Antofagasta lanzan el plan invierno ante posibles chubascos
2011-05-26;17453;Antofagasta;Policial;11;Carabineros no vio brutal riña entre liceanas de Antofagasta
2011-05-26;17411;Antofagasta;Policial;11;Delincuentes roban nuevamente hogar de ancianos y niños en Antofagasta
2011-05-26;17404;Antofagasta;Sociedad;11;Gobierno instalará gigantesca bandera en el muelle histórico en Antofagasta
2011-05-26;17397;Antofagasta;Sociedad;11;Más de 300 estudiantes protestaron frente a la Intendencia en Antofagasta
2011-05-26;17390;Antofagasta;Policial;11;Seremi de Educación pidió una investigación por pelea fuera de un liceo en Antofagasta
2011-05-26;17384;Antofagasta;Sociedad;11;Autoridades de Antofagasta inauguraron la Expomarítima 2011
2011-05-26;17373;Antofagasta;Deportes;11;Alexis Sánchez no llegó a la despedida de su padre adoptivo
2011-05-26;17352;Antofagasta;Policial;11;Una estudiante de Antofagasta azota a su compañera contra un automóvil
2011-05-26;17327;Antofagasta;Cultura;11;Con la película “París” sigue la penúltima jornada del cine europeo
2011-05-26;17322;Antofagasta;Economía y Negocios;11;Antofagasta Minerals aumentó sus ingresos en casi 30 por ciento
2011-05-26;17304;Antofagasta;Policial;11;PDI detectó 70 casos de phishing en tres meses en Antofagasta
2011-05-26;17302;Antofagasta;Deportes;11;Alexis Sánchez llega hoy a despedir a su padre adoptivo
2011-05-25;17288;Antofagasta;Policial;11;Tres muertos deja finalmente accidente carretero al interior de Iquique
2011-05-25;17265;Antofagasta;Sociedad;11;Gobierno lanza fondo para fortalecer las organizaciones sociales de la región
2011-05-25;17260;Antofagasta;Sociedad;11;La Municipalidad destinó 60 millones de pesos a organizaciones comunitarias
2011-05-25;17238;Antofagasta;Deportes;11;La Escuela Dario Salas dijo presente en el Día del Desafío
2011-05-25;17218;Antofagasta;Economía y Negocios;11;Un total de 31 iniciativas postulan a la muestra de innovación de Exponor 2011
2011-05-25;17211;Antofagasta;Sociedad;11;El diputado Pedro Araya valora la iniciativa para acabar con las deudas en educación
2011-05-25;17210;Antofagasta;Sociedad;11;La Federación Minera pide que se derogue la ley de subcontratación
2011-05-25;17200;Antofagasta;Sociedad;11;El Minvu confirma que la Región de Antofagasta posee 21 campamentos
2011-05-25;17183;Antofagasta;Policial;11;Servicio Médico Legal entregará restos de minero perdido hace más de 40 años
2011-05-25;17168;Antofagasta;Sociedad;11;Las instituciones fronterizas de Chile y Argentina realizarán un operativo conjunto
2011-05-25;17151;Antofagasta;Deportes;11;ANFP reprograma partido entre CDA y Lota para el mediodía
2011-05-25;17143;Antofagasta;Tecnología;11;Expertos en Antofagasta producen biocombustibles de calidad industrial
2011-05-25;17127;Antofagasta;Deportes;11;Municipal Mejillones y San Pedro van por la revancha en la Copa Chile
2011-05-25;17087;Antofagasta;Deportes;11;Alexis Sánchez viaja mañana a Tocopilla para el funeral de su padre
2011-05-25;17075;Antofagasta;Sociedad;11;Estudiantes del liceo de Taltal finalizaron su toma
2011-05-24;17046;Antofagasta;Policial;11;Las autoridades confirman que se investigará a fondo para aclarar el accidente minero
2011-05-24;16927;Antofagasta;Policial;11;La PDI detuvo a sujeto que asesinó a su hijastro
2011-05-24;16958;Antofagasta;Policial;11;Evelyn Matthei se conmovió con familiares de las víctimas
2011-05-24;16972;Antofagasta;Policial;11;Menor de 13 años murió tras ser arrollado por un camión en Antofagasta
2011-05-24;16988;Antofagasta;Cultura;11;Cinta italiana se exhibirá en un ciclo de cine europeo en Antofagasta
2011-05-24;16979;Antofagasta;Policial;11;Conductor del bus será operado de urgencia en Antofagasta
2011-05-24;16917;Antofagasta;Policial;11;Federación Minera reclama por las precarias condiciones de trabajo de mineros contratistas
